{
  "candidate_url": "https://github.com/GAMS-dev/gamspy-examples",
  "conditions": [
    {
      "evidence": "No extractable novel surface (dialects already admitted).",
      "id": "new-surface",
      "met": false
    },
    {
      "evidence": "Probe security_boundary unknown or classifier false positive. GAMS examples; 0 regex sites.",
      "id": "security-boundary",
      "met": false
    },
    {
      "evidence": "Below 1000 scale bar.",
      "id": "large-under-saturated",
      "met": false
    }
  ],
  "corpus": "gamspy-examples",
  "corpus_pin": "a52c8ce21fcac3df63ba2b4cae8383679b1733ce",
  "decision": "no-go",
  "decision_basis": "admission_conditions",
  "decision_date": "2026-08-12",
  "escape_hatch_applied": false,
  "probe": {
    "construct_counts": {},
    "dialect": {},
    "flags": {},
    "pin": "a52c8ce21fcac3df63ba2b4cae8383679b1733ce",
    "predicted_buckets": {},
    "regex_sites": 0,
    "regex_sites_per_file": {},
    "security_boundary": "unknown"
  },
  "rationale": "Below admission scale: 0 regex sites (auto-NO-GO bar 200); dialects [none]; boundary=unknown.",
  "schema_version": "1"
}
