{
  "schema_version": "1",
  "candidate_url": "https://github.com/wkhere/stackless",
  "conditions": [
    {
      "id": "new-surface",
      "met": false,
      "evidence": "Probe unavailable (clone failure/timeout) or stackless python fork - duplicate class."
    },
    {
      "id": "security-boundary",
      "met": false,
      "evidence": "Not determinable - probe unavailable."
    },
    {
      "id": "large-under-saturated",
      "met": false,
      "evidence": "Unprobeable or below scale."
    }
  ],
  "corpus": "stackless",
  "corpus_pin": "",
  "decision": "no-go",
  "decision_basis": "admission_conditions",
  "decision_date": "2026-08-12",
  "escape_hatch_applied": false,
  "probe": {
    "regex_sites": 0,
    "dialect": {},
    "flags": {},
    "construct_counts": {},
    "predicted_buckets": {},
    "security_boundary": "unknown",
    "pin": "",
    "extractor_errors": 0,
    "regex_sites_per_file": {}
  },
  "rationale": "stackless python fork - duplicate class. No admission condition met.",
  "related": {
    "probe_failure": "clone failure/timeout"
  }
}