{
 "schema_version": "1",
 "corpus": "ids_rules",
 "candidate_url": "https://github.com/emergingthreats/open",
 "corpus_pin": null,
 "decision": "go",
 "decision_date": "2026-08-09",
 "probe": {
  "regex_sites": 8171,
  "dialect": {
   "pcre": 8171
  },
  "flags": {},
  "predicted_buckets": {
   "backref": 85,
   "bad-range": 1,
   "inline-flag": 90,
   "internal-anchor": 3,
   "lookaround": 174,
   "m-flag": 198,
   "negated-shorthand": 3,
   "pattern-too-long": 186,
   "per-alternative-anchor": 235,
   "unclosed-class": 219,
   "unclosed-group": 1,
   "unsupported-syntax": 4,
   "word-boundary": 11
  },
  "predicted_rejects_pct": null
 },
 "conditions": [
  {
   "id": "new-surface",
   "met": false,
   "evidence": "Backfilled for a pre-gate corpus; admission predates the gate."
  },
  {
   "id": "security-boundary",
   "met": true,
   "evidence": "Security-tool corpus on trust boundaries."
  },
  {
   "id": "large-under-saturated",
   "met": true,
   "evidence": "8171 sites."
  }
 ],
 "escape_hatch_applied": false,
 "rationale": "Fraction 0.8519 meets the 0.30 gate; 6961/8171 encodable, unclassified_parse_errors=0.",
 "related": {
  "backfilled": true,
  "source": "cross_corpus_matrix.json + phase3_decision_matrix.json",
  "repo": "emergingthreats/open"
 },
 "decision_basis": "admission_conditions"
}
