{
  "candidate_url": "https://github.com/octave-commons/promethean",
  "conditions": [
    {
      "evidence": "No extractable novel surface (dialects already admitted).",
      "id": "new-surface",
      "met": false
    },
    {
      "evidence": "Probe security_boundary unknown or classifier false positive. 517 sites < 1000.",
      "id": "security-boundary",
      "met": false
    },
    {
      "evidence": "Below 1000 scale bar (first-party, tests/vendored excluded).",
      "id": "large-under-saturated",
      "met": false
    }
  ],
  "corpus": "promethean",
  "corpus_pin": "06a8b83312ea70dcde6d2e423369b410e6d0d3f2",
  "decision": "no-go",
  "decision_basis": "admission_conditions",
  "decision_date": "2026-08-13",
  "escape_hatch_applied": false,
  "probe": {
    "construct_counts": {
      "lookaround": 9
    },
    "dialect": {
      "ecma": 487,
      "posix-shell": 30
    },
    "flags": {
      "g": 173,
      "i": 76,
      "m": 23,
      "s": 2,
      "u": 1
    },
    "pin": "06a8b83312ea70dcde6d2e423369b410e6d0d3f2",
    "predicted_buckets": {
      "inline-flag": 78,
      "lookaround": 9,
      "m-flag": 23,
      "stateful": 173,
      "u-flag": 1
    },
    "regex_sites": 517,
    "regex_sites_per_file": {
      ".opencode/pseudo/async-sub-agents-final.ts": 10,
      "bin/apply-patch.js": 1,
      "bin/pre-commit.sh": 1,
      "bin/promethean.js": 1,
      "bin/promethean.ts": 1,
      "bin/reset-files-to-original": 2,
      "cli/docs/src/cli.test.ts": 2,
      "cli/docs/src/cli.ts": 5,
      "cli/docs/src/elastic.ts": 1,
      "cli/docs/src/semantic.ts": 1,
      "config/ava.config.mjs": 1,
      "experimental/cephalon/scripts/patch-imports.js": 1,
      "experimental/cephalon/src/enso/runner.ts": 4,
      "experimental/cephalon/src/interactions.ts": 1,
      "experimental/cephalon/src/security/llm-service-enhanced.ts": 5,
      "experimental/cephalon/tests/coverage-boost.test.js": 1,
      "experimental/cephalon/tests/coverage-boost.test.ts": 1,
      "experimental/docs-system/docs/validate-docs.js": 3,
      "experimental/docs-system/src/server/database/connection.ts": 1,
      "experimental/docs-system/src/shared/index.ts": 20,
      "experimental/docs-system/start-dev.sh": 1,
      "experimental/enso-protocol/src/adapter.ts": 1,
      "experimental/enso-protocol/src/cli.ts": 1,
      "experimental/enso-protocol/src/conversation.ts": 7,
      "experimental/enso-protocol/src/registry.ts": 1,
      "experimental/enso-protocol/src/tests/basic.spec.ts": 3,
      "experimental/enso-protocol/src/tests/end-to-end.spec.ts": 1,
      "experimental/enso-protocol/src/tests/mcp-client.spec.ts": 7,
      "experimental/enso-protocol/src/tests/modules.spec.ts": 4,
      "experimental/enso-protocol/src/tests/transport.spec.ts": 2,
      "experimental/enso-protocol/src/ws-server.ts": 1,
      "experimental/enso-protocol/test/tool-registry.test.ts": 1,
      "experimental/heartbeat/index.js": 1,
      "experimental/heartbeat/index.ts": 1,
      "experimental/heartbeat/tests/client.integration.test.js": 1,
      "experimental/pipeline-automation/src/buildfix-integration.ts": 3,
      "experimental/pipeline-automation/src/cli.ts": 1,
      "experimental/pipeline-automation/test-buildfix.js": 1,
      "experimental/pipeline-automation/test-monitoring.js": 1,
      "experimental/pipeline-automation/test-timeout-resources.js": 1,
      "experimental/scar/src/cli/index.ts": 1,
      "experimental/scar/src/core/corruption-detector.ts": 19,
      "experimental/scar/src/core/healers/content-healer.ts": 14,
      "experimental/scar/src/core/healers/encoding-healer.ts": 9,
      "experimental/scar/src/core/healers/filename-healer.ts": 11,
      "experimental/scar/src/core/healers/metadata-healer.ts": 7,
      "experimental/scar/src/core/healers/structure-healer.ts": 6,
      "experimental/scar/src/core/scar-context.ts": 1,
      "experimental/scar/src/core/scar-tracker.ts": 8,
      "hack/ollama.sh": 1,
      "hack/type-checker.ts": 1,
      "run/describe.sh": 9,
      "run/install-clj-python-ml.sh": 1,
      "run/setup_nvidia_container_toolkit.sh": 1,
      "scripts/add-license-to-packages.js": 1,
      "scripts/append-js-extensions.js": 4,
      "scripts/apply_patch.js": 1,
      "scripts/auto-run-on-change.sh": 1,
      "scripts/automation-batch-generator.mjs": 30,
      "scripts/automation-emergency-fixed.mjs": 2,
      "scripts/automation-emergency.mjs": 2,
      "scripts/board-health-monitor.mjs": 9,
      "scripts/catalog.mjs": 1,
      "scripts/check-changelog-fragments.mjs": 1,
      "scripts/check-changelog-fragments.ts": 1,
      "scripts/check-changelog.mjs": 1,
      "scripts/check-changelog.ts": 1,
      "scripts/check_changelog_fragments.ts": 1,
      "scripts/cross-platform-build.js": 1,
      "scripts/cross-platform-test.js": 1,
      "scripts/debug/debug-sync-issue.mjs": 1,
      "scripts/debug/debug-underscore-bug.js": 1,
      "scripts/debug/debug_grep_esm.js": 3,
      "scripts/dedupe-versions.mjs": 10,
      "scripts/deduplicate-logs-simple.js": 1,
      "scripts/deduplicate-logs.js": 13,
      "scripts/dev.mjs": 1,
      "scripts/dev/fix-repeated-tags.js": 23,
      "scripts/dev/fix-sync-issue.mjs": 1,
      "scripts/dev/wip-manager.js": 5,
      "scripts/doc-fix-generator.mjs": 4,
      "scripts/docker-build-cross-platform.sh": 2,
      "scripts/ensure-lockfile.mjs": 1,
      "scripts/eslint-cache-guard.mjs": 1,
      "scripts/eta_mu_docs_indexer.mjs": 22,
      "scripts/find-broken-imports.js": 7,
      "scripts/fix-bins.js": 1,
      "scripts/generate-layer-images.ts": 1,
      "scripts/generate-roadmap-site.ts": 3,
      "scripts/generate-service-docs.js": 2,
      "scripts/generate-tasks-from-labeled.mjs": 9,
      "scripts/git-hooks/submodule-branch-sync.sh": 1,
      "scripts/kanban-metrics.mjs": 2,
      "scripts/launch-agents.mjs": 1,
      "scripts/lint-pipeline-paths.mjs": 8,
      "scripts/lint-taskgen.ts": 3,
      "scripts/lint-topics.ts": 7,
      "scripts/lint_tasks.ts": 2,
      "scripts/merge-coverage.js": 1,
      "scripts/migrate-opencode-config.cjs": 1,
      "scripts/migrate-tests.js": 13,
      "scripts/monitor_evaluation.cjs": 1,
      "scripts/nx-doctor.js": 2,
      "scripts/nx-watcher.mjs": 1,
      "scripts/optimize_evaluation.cjs": 1,
      "scripts/pipeline-fix-generator.mjs": 4,
      "scripts/pipeline-optimizer.mjs": 6,
      "scripts/piper-eslint-tasks.mjs": 1,
      "scripts/pm2-quickstart.mjs": 1,
      "scripts/prom.js": 1,
      "scripts/regen-footers.ts": 7,
      "scripts/rewrite-cross-pks-imports.mjs": 2,
      "scripts/rewrite-imports.mjs": 2,
      "scripts/run-nx-task.mjs": 1,
      "scripts/scaffold-nx.mjs": 1,
      "scripts/security-validation-test.mjs": 1,
      "scripts/security/fast-track-security-testing.mjs": 2,
      "scripts/security/final-mcp-security-validation-fixed.mjs": 4,
      "scripts/security/final-mcp-security-validation.mjs": 5,
      "scripts/security/security-validation.mjs": 24,
      "scripts/setup-clojurescript-lsp.sh": 1,
      "scripts/setup-logging.mjs": 1,
      "scripts/strip-file-extensions.ts": 16,
      "scripts/sync-package-deps.js": 5,
      "scripts/test-fix-generator.mjs": 4,
      "scripts/testing/test-buildfix-optimizations.ts": 1,
      "scripts/testing/test-comprehensive-fix.js": 1,
      "scripts/testing/test-mcp-security-integration.mjs": 1,
      "scripts/testing/test-path-traversal-end-to-end.mjs": 1,
      "scripts/type-fix-automation.mjs": 4,
      "scripts/validate-migration-dependencies.sh": 7,
      "scripts/validate-opencode-config.cjs": 1,
      "scripts/validate-security-build.mjs": 2,
      "scripts/verify-eslint-lsp.sh": 2,
      "scripts/wire-references.mjs": 2
    },
    "security_boundary": "unknown"
  },
  "rationale": "Below admission scale: 517 regex sites (auto-NO-GO bar 200); dialects [ecma:487, posix-shell:30]; boundary=unknown.",
  "schema_version": "1"
}
