{
  "schema_version": "1",
  "candidate_url": "https://github.com/colesbury/nogil-3.12-final",
  "conditions": [
    {
      "id": "new-surface",
      "met": false,
      "evidence": "Clone/checkout failure (git 128 / promisor / write error) - unprobeable at gate budget"
    },
    {
      "id": "security-boundary",
      "met": false,
      "evidence": "Not determinable - probe unavailable."
    },
    {
      "id": "large-under-saturated",
      "met": false,
      "evidence": "Unprobeable; no site count."
    }
  ],
  "corpus": "nogil-3.12-final",
  "corpus_pin": "",
  "decision": "no-go",
  "decision_basis": "admission_conditions",
  "decision_date": "2026-08-12",
  "escape_hatch_applied": false,
  "probe": {
    "regex_sites": 0,
    "dialect": {},
    "flags": {},
    "construct_counts": {},
    "predicted_buckets": {},
    "security_boundary": "unknown",
    "pin": "",
    "extractor_errors": 0,
    "regex_sites_per_file": {}
  },
  "rationale": "Clone/checkout failure (git 128 / promisor / write error) - unprobeable at gate budget. No admission condition met.",
  "related": {
    "probe_failure": "git clone/checkout error"
  }
}