{
  "candidate_url": "https://github.com/code-newbies/ruby-committed",
  "conditions": [
    {
      "evidence": "No extractable novel surface (dialects already admitted).",
      "id": "new-surface",
      "met": false
    },
    {
      "evidence": "Probe security_boundary unknown or classifier false positive. 0 regex sites (workshop).",
      "id": "security-boundary",
      "met": false
    },
    {
      "evidence": "Below 1000 scale bar (first-party, tests/vendored excluded).",
      "id": "large-under-saturated",
      "met": false
    }
  ],
  "corpus": "ruby-committed",
  "corpus_pin": "a04f3119a617a82383cce44abc49359e2582e245",
  "decision": "no-go",
  "decision_basis": "admission_conditions",
  "decision_date": "2026-08-13",
  "escape_hatch_applied": false,
  "probe": {
    "construct_counts": {},
    "dialect": {},
    "flags": {},
    "pin": "a04f3119a617a82383cce44abc49359e2582e245",
    "predicted_buckets": {},
    "regex_sites": 0,
    "regex_sites_per_file": {},
    "security_boundary": "unknown"
  },
  "rationale": "Below admission scale: 0 regex sites (auto-NO-GO bar 200); dialects [none]; boundary=unknown.",
  "schema_version": "1"
}
