{
  "candidate_url": "https://github.com/bransoned/MemorEasy",
  "conditions": [
    {
      "evidence": "No extractable novel surface (dialects already admitted).",
      "id": "new-surface",
      "met": false
    },
    {
      "evidence": "Probe security_boundary unknown or false positive. bransoned; 1 py_re site.",
      "id": "security-boundary",
      "met": false
    },
    {
      "evidence": "Below 1000 scale bar (or unprobeable).",
      "id": "large-under-saturated",
      "met": false
    }
  ],
  "corpus": "MemorEasy",
  "corpus_pin": "6e349a740774d1b92f00b91aef5528d666e50eed",
  "decision": "no-go",
  "decision_basis": "admission_conditions",
  "decision_date": "2026-08-12",
  "escape_hatch_applied": false,
  "probe": {
    "construct_counts": {},
    "dialect": {
      "py_re": 1
    },
    "flags": {},
    "pin": "6e349a740774d1b92f00b91aef5528d666e50eed",
    "predicted_buckets": {},
    "regex_sites": 1,
    "regex_sites_per_file": {
      "src/parsers.py": 1
    },
    "security_boundary": "unknown"
  },
  "rationale": "Below admission scale: 1 regex sites (auto-NO-GO bar 200); dialects [py_re:1]; boundary=unknown.",
  "schema_version": "1"
}
