{
  "candidate_url": "https://github.com/lfzawacki/musical-artifacts",
  "conditions": [
    {
      "evidence": "No extractable novel surface (dialects already admitted).",
      "id": "new-surface",
      "met": false
    },
    {
      "evidence": "Probe security_boundary unknown or classifier false positive. 0 regex sites.",
      "id": "security-boundary",
      "met": false
    },
    {
      "evidence": "Below 1000 scale bar.",
      "id": "large-under-saturated",
      "met": false
    }
  ],
  "corpus": "musical-artifacts",
  "corpus_pin": "a009ed4e4f5418a99f6876cf63d0453d34352e76",
  "decision": "no-go",
  "decision_basis": "admission_conditions",
  "decision_date": "2026-08-13",
  "escape_hatch_applied": false,
  "probe": {
    "construct_counts": {},
    "dialect": {},
    "flags": {},
    "pin": "a009ed4e4f5418a99f6876cf63d0453d34352e76",
    "predicted_buckets": {},
    "regex_sites": 0,
    "regex_sites_per_file": {},
    "security_boundary": "unknown"
  },
  "rationale": "Below admission scale: 0 regex sites (auto-NO-GO bar 200); dialects [none]; boundary=unknown.",
  "schema_version": "1"
}
