{
  "candidate_url": "https://github.com/TheRealHaoLiu/cardputer-adv",
  "conditions": [
    {
      "evidence": "No extractable novel surface (dialects already admitted).",
      "id": "new-surface",
      "met": false
    },
    {
      "evidence": "Probe security_boundary unknown or classifier false positive. cardputer adventure; 0 regex sites.",
      "id": "security-boundary",
      "met": false
    },
    {
      "evidence": "Below 1000 scale bar.",
      "id": "large-under-saturated",
      "met": false
    }
  ],
  "corpus": "cardputer-adv",
  "corpus_pin": "b472dd091b5d0228d3747b3a7175366edc20fc58",
  "decision": "no-go",
  "decision_basis": "admission_conditions",
  "decision_date": "2026-08-12",
  "escape_hatch_applied": false,
  "probe": {
    "construct_counts": {},
    "dialect": {},
    "flags": {},
    "pin": "b472dd091b5d0228d3747b3a7175366edc20fc58",
    "predicted_buckets": {},
    "regex_sites": 0,
    "regex_sites_per_file": {},
    "security_boundary": "deterministic-true"
  },
  "rationale": "Below admission scale: 0 regex sites (auto-NO-GO bar 200); dialects [none]; boundary=deterministic-true.",
  "schema_version": "1"
}
